{
  "accuracy": "exact-double",
  "constants_sha256": "d4ddcbf81bad6fc0c7e3e76a49cb15d214a5dd5a41e83a0e96cbe5850323f009",
  "counters": {
    "blockH": {
      "jacobian_calls": 0,
      "value_calls": 1
    },
    "blockK": {
      "jacobian_calls": 0,
      "value_calls": 1
    }
  },
  "equation_ids": [
    "bal_A",
    "bal_B",
    "bal_C",
    "Vdef",
    "Ldef",
    "eq_A",
    "eq_B",
    "eq_C",
    "kdef_A",
    "kdef_B",
    "kdef_C",
    "hdef_A",
    "hdef_B",
    "hdef_C",
    "energy",
    "tspec",
    "pspec"
  ],
  "message": "",
  "model_version": "SYN-001-L-1@8e5930fc737e8e0b033a2fe35d06971c6cf911df2db5d9731e050cf1cb6fb98a",
  "phase_signature": null,
  "state_sha256": "01717133b4bbc41ce322cf4648ac8dbe570ed4a0d9f4f13d096239336058867f",
  "status": "ok",
  "values": [
    0.0,
    0.0,
    0.0,
    0.0,
    0.0,
    -2.220446049250313e-16,
    0.0,
    5.551115123125783e-17,
    -2.220446049250313e-16,
    0.0,
    2.220446049250313e-16,
    0.0,
    0.0,
    0.0,
    0.0,
    0.0,
    0.0
  ]
}
